category_slug,subcategory_slug,text,difficulty,explanation,law_name,law_article,source_url,law_version_date,is_prime,option_a,option_b,option_c,option_d,correct_option
constitutional,constitution,"საქართველოს კონსტიტუციის მიხედვით, რა მიზნით იქმნება პარლამენტის კომიტეტები?",medium,"სწორი პასუხია A, რადგან საქართველოს კონსტიტუციის მუხლი 41 ადგენს, რომ კომიტეტები იქმნება საკანონმდებლო საკითხების წინასწარი მომზადების, გადაწყვეტილებათა შესრულების ხელშეწყობისა და კონტროლის მიზნით.",საქართველოს კონსტიტუცია,მუხლი 41,,2018-03-23,false,საკანონმდებლო საკითხების მომზადებისა და კონტროლის მიზნით,მხოლოდ სასამართლო გადაწყვეტილებების შეცვლის მიზნით,მხოლოდ პოლიტიკური პარტიების რეგისტრაციის მიზნით,მხოლოდ სახელმწიფო ბიუჯეტის ხელმოწერის მიზნით,A
constitutional,constitution,"საქართველოს კონსტიტუციის მიხედვით, პარლამენტის წევრთა რა რაოდენობის ინიციატივით შეიძლება შეიქმნას საგამოძიებო და სხვა დროებითი კომისიები?",hard,"სწორი პასუხია C, რადგან საქართველოს კონსტიტუციის მუხლი 42 ადგენს, რომ ასეთი კომისიები იქმნება რეგლამენტით გათვალისწინებულ შემთხვევებში ან პარლამენტის წევრთა არანაკლებ ერთი მეხუთედის ინიციატივით.",საქართველოს კონსტიტუცია,მუხლი 42,,2018-03-23,false,არანაკლებ ერთი მეათედის ინიციატივით,არანაკლებ ნახევრის ინიციატივით,არანაკლებ ერთი მეხუთედის ინიციატივით,მხოლოდ მთავრობის ინიციატივით,C
constitutional,constitution,"საქართველოს კონსტიტუციის მიხედვით, ვის შეიძლება მიმართოს კითხვით პარლამენტის წევრმა?",medium,"სწორი პასუხია B, რადგან საქართველოს კონსტიტუციის მუხლი 43 პარლამენტის წევრს აძლევს უფლებას კითხვით მიმართოს მთავრობას, პარლამენტის წინაშე ანგარიშვალდებულ ორგანოს, მთავრობის წევრს, ტერიტორიული ერთეულის ხელისუფლების ორგანოს ან სახელმწიფო დაწესებულებას.",საქართველოს კონსტიტუცია,მუხლი 43,,2018-03-23,false,მხოლოდ კერძო კომპანიას,მთავრობას და პარლამენტის წინაშე ანგარიშვალდებულ ორგანოებს,მხოლოდ საკონსტიტუციო სასამართლოს მოსამართლეს,მხოლოდ ადგილობრივ ამომრჩეველს,B
constitutional,constitution,"საქართველოს კონსტიტუციის მიხედვით, წელიწადში რამდენჯერ იკრიბება პარლამენტი მორიგ სესიაზე?",easy,"სწორი პასუხია A, რადგან საქართველოს კონსტიტუციის მუხლი 44 ადგენს, რომ პარლამენტი თავისი უფლებით იკრიბება მორიგ სესიაზე წელიწადში ორჯერ.",საქართველოს კონსტიტუცია,მუხლი 44,,2018-03-23,false,წელიწადში ორჯერ,წელიწადში ერთხელ,ყოველთვიურად,მხოლოდ საგანგებო მდგომარეობისას,A
constitutional,constitution,"საქართველოს კონსტიტუციის მიხედვით, ვის აქვს საკანონმდებლო ინიციატივის უფლება?",medium,"სწორი პასუხია D, რადგან საქართველოს კონსტიტუციის მუხლი 45 საკანონმდებლო ინიციატივის უფლებას ანიჭებს მთავრობას, პარლამენტის წევრს, ფრაქციას, კომიტეტს, ავტონომიური რესპუბლიკების უმაღლეს წარმომადგენლობით ორგანოებს და არანაკლებ 25000 ამომრჩეველს.",საქართველოს კონსტიტუცია,მუხლი 45,,2018-03-23,false,მხოლოდ პრეზიდენტს,მხოლოდ სასამართლოებს,მხოლოდ მუნიციპალიტეტებს,"მთავრობას, პარლამენტის სუბიექტებს და არანაკლებ 25000 ამომრჩეველს",D
constitutional,constitution,"საქართველოს კონსტიტუციის მიხედვით, რა ვადაში გადაეცემა პარლამენტის მიერ მიღებული კანონი საქართველოს პრეზიდენტს?",easy,"სწორი პასუხია B, რადგან საქართველოს კონსტიტუციის მუხლი 46 ადგენს, რომ პარლამენტის მიერ მიღებული კანონი 10 დღის ვადაში გადაეცემა საქართველოს პრეზიდენტს.",საქართველოს კონსტიტუცია,მუხლი 46,,2018-03-23,false,5 დღის ვადაში,10 დღის ვადაში,2 კვირის ვადაში,30 დღის ვადაში,B
constitutional,constitution,"საქართველოს კონსტიტუციის მიხედვით, როდის შედის კანონი ძალაში, თუ იმავე კანონით სხვა ვადა არ არის დადგენილი?",medium,"სწორი პასუხია C, რადგან საქართველოს კონსტიტუციის მუხლი 46 ადგენს, რომ კანონი ძალაში შედის ოფიციალურ ორგანოში გამოქვეყნებიდან მე-15 დღეს, თუ იმავე კანონით სხვა ვადა არ არის დადგენილი.",საქართველოს კონსტიტუცია,მუხლი 46,,2018-03-23,false,გამოქვეყნებისთანავე,გამოქვეყნებიდან მე-5 დღეს,გამოქვეყნებიდან მე-15 დღეს,პრეზიდენტისთვის გადაცემიდან მე-10 დღეს,C
constitutional,constitution,"საქართველოს კონსტიტუციის მიხედვით, რომელი საერთაშორისო ხელშეკრულება საჭიროებს სავალდებულო რატიფიცირებას?",hard,"სწორი პასუხია A, რადგან საქართველოს კონსტიტუციის მუხლი 47 სავალდებულო რატიფიცირებას უკავშირებს, მათ შორის, სამხედრო ხასიათის საერთაშორისო ხელშეკრულებას.",საქართველოს კონსტიტუცია,მუხლი 47,,2018-03-23,false,სამხედრო ხასიათის საერთაშორისო ხელშეკრულება,მხოლოდ კერძო სამართლის გარიგება,მხოლოდ ადგილობრივი თვითმმართველობის შეთანხმება,მხოლოდ არასამთავრობო ორგანიზაციის მემორანდუმი,A
constitutional,constitution,"საქართველოს კონსტიტუციის მიხედვით, რომელი ორგანო განიხილავს იმპიჩმენტის საკითხს კონსტიტუციის დარღვევის ან დანაშაულის ნიშნების შესახებ დასკვნის მოსამზადებლად?",hard,"სწორი პასუხია C, რადგან საქართველოს კონსტიტუციის მუხლი 48 ადგენს, რომ იმპიჩმენტის საკითხი გადაეცემა საკონსტიტუციო სასამართლოს, რომელიც პარლამენტს დასკვნას წარუდგენს ერთი თვის ვადაში.",საქართველოს კონსტიტუცია,მუხლი 48,,2018-03-23,false,სახელმწიფო აუდიტის სამსახური,საქართველოს მთავრობა,საკონსტიტუციო სასამართლო,ეროვნული ბანკი,C
constitutional,constitution,"საქართველოს კონსტიტუციის მიხედვით, რა სტატუსი აქვს საქართველოს პრეზიდენტს?",easy,"სწორი პასუხია D, რადგან საქართველოს კონსტიტუციის მუხლი 49 ადგენს, რომ საქართველოს პრეზიდენტი არის სახელმწიფოს მეთაური, ქვეყნის ერთიანობისა და ეროვნული დამოუკიდებლობის გარანტი.",საქართველოს კონსტიტუცია,მუხლი 49,,2018-03-23,false,პარლამენტის კომიტეტის თავმჯდომარე,საერთო სასამართლოების ხელმძღვანელი,სახელმწიფო აუდიტის სამსახურის უფროსი,სახელმწიფოს მეთაური და ქვეყნის ერთიანობის გარანტი,D
constitutional,constitution,"საქართველოს კონსტიტუციის მიხედვით, რა ვადით ირჩევს საარჩევნო კოლეგია საქართველოს პრეზიდენტს?",easy,"სწორი პასუხია A, რადგან საქართველოს კონსტიტუციის მუხლი 50 ადგენს, რომ პრეზიდენტს საარჩევნო კოლეგია 5 წლის ვადით ირჩევს.",საქართველოს კონსტიტუცია,მუხლი 50,,2018-03-23,false,5 წლის ვადით,4 წლის ვადით,6 წლის ვადით,10 წლის ვადით,A
constitutional,constitution,"საქართველოს კონსტიტუციის მიხედვით, რა ასაკიდან შეიძლება აირჩეს პირი საქართველოს პრეზიდენტად?",medium,"სწორი პასუხია B, რადგან საქართველოს კონსტიტუციის მუხლი 50 ადგენს, რომ საქართველოს პრეზიდენტად შეიძლება აირჩეს საარჩევნო უფლების მქონე საქართველოს მოქალაქე 40 წლის ასაკიდან, რომელსაც საქართველოში უცხოვრია 15 წელს მაინც.",საქართველოს კონსტიტუცია,მუხლი 50,,2018-03-23,false,35 წლის ასაკიდან,40 წლის ასაკიდან,30 წლის ასაკიდან,25 წლის ასაკიდან,B
constitutional,constitution,"საქართველოს კონსტიტუციის მიხედვით, როდის იწყება ახალარჩეული პრეზიდენტის უფლებამოსილება?",medium,"სწორი პასუხია C, რადგან საქართველოს კონსტიტუციის მუხლი 51 ადგენს, რომ ახალარჩეული პრეზიდენტის უფლებამოსილება იწყება მის მიერ ფიცის დადებისთანავე.",საქართველოს კონსტიტუცია,მუხლი 51,,2018-03-23,false,არჩევნების შედეგების გამოცხადებისთანავე,პარლამენტის თავმჯდომარის ბრძანებისთანავე,ფიცის დადებისთანავე,მთავრობის ნდობის გამოცხადებისთანავე,C
constitutional,constitution,"საქართველოს კონსტიტუციის მიხედვით, ვინ ასრულებს პრეზიდენტის მოვალეობას პრეზიდენტის უფლებამოსილების ვადამდე შეწყვეტის ან განხორციელების შეუძლებლობის შემთხვევაში?",medium,"სწორი პასუხია D, რადგან საქართველოს კონსტიტუციის მუხლი 51 ადგენს, რომ ასეთ შემთხვევაში პრეზიდენტის მოვალეობას ასრულებს პარლამენტის თავმჯდომარე.",საქართველოს კონსტიტუცია,მუხლი 51,,2018-03-23,false,პრემიერ-მინისტრი,საკონსტიტუციო სასამართლოს თავმჯდომარე,ეროვნული ბანკის პრეზიდენტი,პარლამენტის თავმჯდომარე,D
constitutional,constitution,"საქართველოს კონსტიტუციის მიხედვით, რომელი უფლებამოსილება აქვს პრეზიდენტს მოქალაქეობის საკითხებთან დაკავშირებით?",medium,"სწორი პასუხია A, რადგან საქართველოს კონსტიტუციის მუხლი 52 ადგენს, რომ პრეზიდენტი ორგანული კანონით დადგენილი წესით წყვეტს მოქალაქეობის საკითხებს.",საქართველოს კონსტიტუცია,მუხლი 52,,2018-03-23,false,ორგანული კანონით დადგენილი წესით წყვეტს მოქალაქეობის საკითხებს,ადგენს სასამართლოების იურისდიქციას,იღებს სახელმწიფო ბიუჯეტის კანონს,ნიშნავს ყველა მოსამართლეს უვადოდ,A
constitutional,constitution,"საქართველოს კონსტიტუციის მიხედვით, რა საკითხზე არ შეიძლება რეფერენდუმის ჩატარება?",hard,"სწორი პასუხია C, რადგან საქართველოს კონსტიტუციის მუხლი 52 კრძალავს რეფერენდუმის ჩატარებას კანონის მისაღებად ან გასაუქმებლად, ამნისტიის ან შეწყალების გამო, საერთაშორისო ხელშეკრულებების რატიფიცირების ან დენონსირების შესახებ და ისეთ საკითხზე, რომელიც ადამიანის ძირითადი უფლების შეზღუდვას ითვალისწინებს.",საქართველოს კონსტიტუცია,მუხლი 52,,2018-03-23,false,კონსტიტუციითა და კანონით განსაზღვრულ ზოგად საკითხზე,პარლამენტის ან მთავრობის მოთხოვნით დასმულ საკითხზე,კანონის მისაღებად ან გასაუქმებლად,არანაკლებ 200000 ამომრჩევლის მოთხოვნით დასმულ საკითხზე,C
constitutional,constitution,"საქართველოს კონსტიტუციის მიხედვით, რა არის პრეზიდენტის სამართლებრივი აქტის თანახელმოწერის ზოგადი წესი?",medium,"სწორი პასუხია B, რადგან საქართველოს კონსტიტუციის მუხლი 53 ადგენს, რომ პრეზიდენტის სამართლებრივი აქტი საჭიროებს პრემიერ-მინისტრის თანახელმოწერას და სამართლებრივ შედეგებს წარმოშობს მხოლოდ თანახელმოწერის შემდეგ.",საქართველოს კონსტიტუცია,მუხლი 53,,2018-03-23,false,აქტი ყოველთვის მოქმედებს ხელმოწერის გარეშე,"პრეზიდენტის სამართლებრივი აქტი, როგორც წესი, საჭიროებს პრემიერ-მინისტრის თანახელმოწერას",აქტი საჭიროებს მხოლოდ პარლამენტის წევრის თანახელმოწერას,თანახელმოწერა სჭირდება მხოლოდ სასამართლო გადაწყვეტილებებს,B
constitutional,constitution,"საქართველოს კონსტიტუციის მიხედვით, რა სტატუსი აქვს საქართველოს მთავრობას?",easy,"სწორი პასუხია D, რადგან საქართველოს კონსტიტუციის მუხლი 54 ადგენს, რომ მთავრობა არის აღმასრულებელი ხელისუფლების უმაღლესი ორგანო.",საქართველოს კონსტიტუცია,მუხლი 54,,2018-03-23,false,ქვეყნის უმაღლესი წარმომადგენლობითი ორგანო,საკონსტიტუციო კონტროლის სასამართლო ორგანო,მონეტარული პოლიტიკის ორგანო,აღმასრულებელი ხელისუფლების უმაღლესი ორგანო,D
constitutional,constitution,"საქართველოს კონსტიტუციის მიხედვით, ვის წინაშეა მთავრობა ანგარიშვალდებული და პასუხისმგებელი?",easy,"სწორი პასუხია A, რადგან საქართველოს კონსტიტუციის მუხლი 54 ადგენს, რომ მთავრობა ანგარიშვალდებული და პასუხისმგებელია პარლამენტის წინაშე.",საქართველოს კონსტიტუცია,მუხლი 54,,2018-03-23,false,პარლამენტის წინაშე,მხოლოდ პრეზიდენტის წინაშე,მხოლოდ ადგილობრივი თვითმმართველობის წინაშე,ეროვნული ბანკის წინაშე,A
constitutional,constitution,"საქართველოს კონსტიტუციის მიხედვით, ვინ არის მთავრობის მეთაური?",easy,"სწორი პასუხია C, რადგან საქართველოს კონსტიტუციის მუხლი 55 ადგენს, რომ მთავრობის მეთაურია საქართველოს პრემიერ-მინისტრი.",საქართველოს კონსტიტუცია,მუხლი 55,,2018-03-23,false,საქართველოს პრეზიდენტი,პარლამენტის თავმჯდომარე,საქართველოს პრემიერ-მინისტრი,გენერალური პროკურორი,C
