category_slug,subcategory_slug,text,difficulty,explanation,law_name,law_article,source_url,law_version_date,is_prime,option_a,option_b,option_c,option_d,correct_option
constitutional,constitution,"საქართველოს კონსტიტუციის მიხედვით, პრემიერ-მინისტრის გადადგომისას როდის უწყდება მას უფლებამოსილება?",medium,"სწორი პასუხია B, რადგან საქართველოს კონსტიტუციის მუხლი 56 ადგენს, რომ პრემიერ-მინისტრის გადადგომის შემთხვევაში მას უფლებამოსილება უწყდება გადადგომისთანავე.",საქართველოს კონსტიტუცია,მუხლი 56,,2018-03-23,false,ახალი პარლამენტის არჩევისთანავე,გადადგომისთანავე,პრეზიდენტის ბრძანებიდან ერთი თვის შემდეგ,საკონსტიტუციო სასამართლოს დასკვნის შემდეგ,B
constitutional,constitution,"საქართველოს კონსტიტუციის მიხედვით, ვის აქვს მთავრობისთვის უნდობლობის საკითხის აღძვრის უფლება?",hard,"სწორი პასუხია D, რადგან საქართველოს კონსტიტუციის მუხლი 57 ადგენს, რომ უნდობლობის საკითხის აღძვრის უფლება აქვს პარლამენტის სრული შემადგენლობის ერთ მესამედზე მეტს.",საქართველოს კონსტიტუცია,მუხლი 57,,2018-03-23,false,მხოლოდ საქართველოს პრეზიდენტს,მხოლოდ პრემიერ-მინისტრს,მხოლოდ პარლამენტის თავმჯდომარეს,პარლამენტის სრული შემადგენლობის ერთ მესამედზე მეტს,D
constitutional,constitution,"საქართველოს კონსტიტუციის მიხედვით, რა ვადაში ეყრება კენჭი პრემიერ-მინისტრის მიერ დასმულ მთავრობის ნდობის საკითხს?",hard,"სწორი პასუხია A, რადგან საქართველოს კონსტიტუციის მუხლი 58 ადგენს, რომ ნდობის საკითხს კენჭი ეყრება მისი დასმიდან არაუადრეს მე-7 და არაუგვიანეს მე-14 დღისა.",საქართველოს კონსტიტუცია,მუხლი 58,,2018-03-23,false,არაუადრეს მე-7 და არაუგვიანეს მე-14 დღისა,დასმიდან 48 საათში,დასმიდან არაუგვიანეს 30 დღისა,მხოლოდ მომდევნო სესიის დაწყებისას,A
constitutional,constitution,"საქართველოს კონსტიტუციის მიხედვით, რომელი ორგანოები ახორციელებენ სასამართლო ხელისუფლებას?",easy,"სწორი პასუხია C, რადგან საქართველოს კონსტიტუციის მუხლი 59 ადგენს, რომ სასამართლო ხელისუფლებას ახორციელებენ საქართველოს საკონსტიტუციო სასამართლო და საქართველოს საერთო სასამართლოები.",საქართველოს კონსტიტუცია,მუხლი 59,,2018-03-23,false,მთავრობა და სამინისტროები,პროკურატურა და სახელმწიფო აუდიტის სამსახური,საკონსტიტუციო სასამართლო და საერთო სასამართლოები,ეროვნული ბანკი და პარლამენტი,C
constitutional,constitution,"საქართველოს კონსტიტუციის მიხედვით, რა არის დაუშვებელი სასამართლო სისტემასთან დაკავშირებით?",medium,"სწორი პასუხია B, რადგან საქართველოს კონსტიტუციის მუხლი 59 ადგენს, რომ საგანგებო სასამართლოების შექმნა დაუშვებელია.",საქართველოს კონსტიტუცია,მუხლი 59,,2018-03-23,false,საერთო სასამართლოების მიერ მართლმსაჯულების განხორციელება,საგანგებო სასამართლოების შექმნა,საკონსტიტუციო სასამართლოს არსებობა,სპეციალიზებული სასამართლოს შექმნა საერთო სასამართლოების სისტემაში,B
constitutional,constitution,"საქართველოს კონსტიტუციის მიხედვით, რამდენი მოსამართლისაგან შედგება საკონსტიტუციო სასამართლო?",easy,"სწორი პასუხია A, რადგან საქართველოს კონსტიტუციის მუხლი 60 ადგენს, რომ საკონსტიტუციო სასამართლო შედგება 10 წლის ვადით განწესებული 9 მოსამართლისაგან.",საქართველოს კონსტიტუცია,მუხლი 60,,2018-03-23,false,9 მოსამართლისაგან,7 მოსამართლისაგან,12 მოსამართლისაგან,15 მოსამართლისაგან,A
constitutional,constitution,"საქართველოს კონსტიტუციის მიხედვით, რა ძალა აქვს საკონსტიტუციო სასამართლოს გადაწყვეტილებას?",medium,"სწორი პასუხია D, რადგან საქართველოს კონსტიტუციის მუხლი 60 ადგენს, რომ საკონსტიტუციო სასამართლოს გადაწყვეტილება საბოლოოა.",საქართველოს კონსტიტუცია,მუხლი 60,,2018-03-23,false,იგი საჭიროებს მთავრობის დამტკიცებას,იგი მხოლოდ რეკომენდაციაა,იგი ძალაში შედის პარლამენტის თავმჯდომარის თანხმობით,იგი საბოლოოა,D
constitutional,constitution,"საქართველოს კონსტიტუციის მიხედვით, რა არის საქართველოს უზენაესი სასამართლო?",easy,"სწორი პასუხია B, რადგან საქართველოს კონსტიტუციის მუხლი 61 ადგენს, რომ საქართველოს უზენაესი სასამართლო არის საკასაციო სასამართლო.",საქართველოს კონსტიტუცია,მუხლი 61,,2018-03-23,false,პირველი ინსტანციის ადმინისტრაციული ორგანო,საკასაციო სასამართლო,მთავრობის საკონსულტაციო ორგანო,საფინანსო ზედამხედველობის ორგანო,B
constitutional,constitution,"საქართველოს კონსტიტუციის მიხედვით, რამდენი მოსამართლე უნდა შედიოდეს უზენაესი სასამართლოს შემადგენლობაში მინიმუმ?",medium,"სწორი პასუხია C, რადგან საქართველოს კონსტიტუციის მუხლი 61 ადგენს, რომ უზენაესი სასამართლოს შემადგენლობაში შედის არანაკლებ 28 მოსამართლე.",საქართველოს კონსტიტუცია,მუხლი 61,,2018-03-23,false,არანაკლებ 9 მოსამართლე,არანაკლებ 15 მოსამართლე,არანაკლებ 28 მოსამართლე,არანაკლებ 50 მოსამართლე,C
constitutional,constitution,"საქართველოს კონსტიტუციის მიხედვით, რა ენაზე ხორციელდება სამართალწარმოება?",easy,"სწორი პასუხია D, რადგან საქართველოს კონსტიტუციის მუხლი 62 ადგენს, რომ სამართალწარმოება ხორციელდება სახელმწიფო ენაზე.",საქართველოს კონსტიტუცია,მუხლი 62,,2018-03-23,false,მხოლოდ მხარეთა შეთანხმებით არჩეულ ენაზე,მხოლოდ ინგლისურ ენაზე,მხოლოდ სასამართლოს მიერ შერჩეულ უცხო ენაზე,სახელმწიფო ენაზე,D
constitutional,constitution,"საქართველოს კონსტიტუციის მიხედვით, რას ემორჩილება მოსამართლე თავის საქმიანობაში?",easy,"სწორი პასუხია A, რადგან საქართველოს კონსტიტუციის მუხლი 63 ადგენს, რომ მოსამართლე დამოუკიდებელია და ემორჩილება მხოლოდ კონსტიტუციასა და კანონს.",საქართველოს კონსტიტუცია,მუხლი 63,,2018-03-23,false,მხოლოდ კონსტიტუციასა და კანონს,მთავრობის პოლიტიკურ მითითებებს,პარტიის წესდებას,ადგილობრივი ორგანოს რეკომენდაციას,A
constitutional,constitution,"საქართველოს კონსტიტუციის მიხედვით, რა მიზნისთვის იქმნება იუსტიციის უმაღლესი საბჭო?",medium,"სწორი პასუხია C, რადგან საქართველოს კონსტიტუციის მუხლი 64 ადგენს, რომ იუსტიციის უმაღლესი საბჭო იქმნება საერთო სასამართლოების დამოუკიდებლობისა და ეფექტიანობის უზრუნველყოფის, მოსამართლეთა დანიშვნისა და გათავისუფლების და სხვა ამოცანების შესრულების მიზნით.",საქართველოს კონსტიტუცია,მუხლი 64,,2018-03-23,false,სახელმწიფო ბიუჯეტის დამტკიცებისთვის,ეროვნული ბანკის მართვისთვის,საერთო სასამართლოების დამოუკიდებლობისა და ეფექტიანობის უზრუნველსაყოფად,საგარეო ხელშეკრულებების რატიფიცირებისთვის,C
constitutional,constitution,"საქართველოს კონსტიტუციის მიხედვით, რა ვადით ირჩევს პარლამენტი გენერალურ პროკურორს?",medium,"სწორი პასუხია B, რადგან საქართველოს კონსტიტუციის მუხლი 65 ადგენს, რომ გენერალურ პროკურორს პარლამენტი ირჩევს 6 წლის ვადით.",საქართველოს კონსტიტუცია,მუხლი 65,,2018-03-23,false,4 წლის ვადით,6 წლის ვადით,5 წლის ვადით,10 წლის ვადით,B
constitutional,constitution,"საქართველოს კონსტიტუციის მიხედვით, ვინ არის უფლებამოსილი პარლამენტს წარუდგინოს სახელმწიფო ბიუჯეტის პროექტი?",medium,"სწორი პასუხია D, რადგან საქართველოს კონსტიტუციის მუხლი 66 ადგენს, რომ მხოლოდ მთავრობაა უფლებამოსილი პარლამენტს წარუდგინოს სახელმწიფო ბიუჯეტის პროექტი.",საქართველოს კონსტიტუცია,მუხლი 66,,2018-03-23,false,საქართველოს პრეზიდენტი,ეროვნული ბანკი,სახელმწიფო აუდიტის სამსახური,მხოლოდ მთავრობა,D
constitutional,constitution,"საქართველოს კონსტიტუციის მიხედვით, როდის წარუდგენს მთავრობა მომდევნო საბიუჯეტო წლის სახელმწიფო ბიუჯეტის პროექტს პარლამენტს?",hard,"სწორი პასუხია A, რადგან საქართველოს კონსტიტუციის მუხლი 66 ადგენს, რომ მთავრობა პროექტს წარადგენს საბიუჯეტო წლის დასრულებამდე არაუგვიანეს 3 თვისა.",საქართველოს კონსტიტუცია,მუხლი 66,,2018-03-23,false,საბიუჯეტო წლის დასრულებამდე არაუგვიანეს 3 თვისა,საბიუჯეტო წლის დაწყებიდან 5 თვის შემდეგ,მხოლოდ პრეზიდენტის მოთხოვნის შემდეგ,ახალი პარლამენტის არჩევიდან 10 დღეში,A
constitutional,constitution,"საქართველოს კონსტიტუციის მიხედვით, როგორ დგინდება გადასახადებისა და მოსაკრებლების სტრუქტურა და განაკვეთები?",medium,"სწორი პასუხია C, რადგან საქართველოს კონსტიტუციის მუხლი 67 ადგენს, რომ მხოლოდ კანონით შეიძლება გადასახადებისა და მოსაკრებლების სტრუქტურისა და შემოღების წესის, მათი განაკვეთების ან განაკვეთების ფარგლების დადგენა.",საქართველოს კონსტიტუცია,მუხლი 67,,2018-03-23,false,მხოლოდ მთავრობის ზეპირი დავალებით,მხოლოდ კერძო შეთანხმებით,მხოლოდ კანონით,მხოლოდ მუნიციპალიტეტის ბიულეტენით,C
constitutional,constitution,"საქართველოს კონსტიტუციის მიხედვით, რა ძირითადი ფუნქცია აქვს საქართველოს ეროვნულ ბანკს?",medium,"სწორი პასუხია B, რადგან საქართველოს კონსტიტუციის მუხლი 68 ადგენს, რომ ეროვნული ბანკი წარმართავს მონეტარულ პოლიტიკას ფასების სტაბილურობის უზრუნველსაყოფად და ხელს უწყობს ფინანსური სექტორის სტაბილურ ფუნქციონირებას.",საქართველოს კონსტიტუცია,მუხლი 68,,2018-03-23,false,სასამართლო ხელისუფლების განხორციელება,მონეტარული პოლიტიკის წარმართვა და ფინანსური სექტორის სტაბილურობის ხელშეწყობა,პარლამენტის კომიტეტების შექმნა,მთავრობის წევრების დანიშვნა,B
constitutional,constitution,"საქართველოს კონსტიტუციის მიხედვით, ვის აქვს ფულის ემისიის უფლება?",easy,"სწორი პასუხია A, რადგან საქართველოს კონსტიტუციის მუხლი 68 ადგენს, რომ ფულის ემისიის უფლება აქვს მხოლოდ ეროვნულ ბანკს.",საქართველოს კონსტიტუცია,მუხლი 68,,2018-03-23,false,მხოლოდ ეროვნულ ბანკს,მთავრობას და მუნიციპალიტეტებს,ყველა კომერციულ ბანკს,პარლამენტის ნებისმიერ კომიტეტს,A
constitutional,constitution,"საქართველოს კონსტიტუციის მიხედვით, რომელ ორგანოს ევალება საბიუჯეტო სახსრებისა და სხვა საჯარო რესურსების გამოყენებისა და ხარჯვის ზედამხედველობა?",medium,"სწორი პასუხია D, რადგან საქართველოს კონსტიტუციის მუხლი 69 ადგენს, რომ ამ ფუნქციას ახორციელებს სახელმწიფო აუდიტის სამსახური.",საქართველოს კონსტიტუცია,მუხლი 69,,2018-03-23,false,საქართველოს მთავრობა,საკონსტიტუციო სასამართლო,ეროვნული ბანკის საბჭო,სახელმწიფო აუდიტის სამსახური,D
constitutional,constitution,"საქართველოს კონსტიტუციის მიხედვით, რა არის საქართველოს ყოველი მოქალაქის ვალი თავდაცვის სფეროში?",easy,"სწორი პასუხია C, რადგან საქართველოს კონსტიტუციის მუხლი 70 ადგენს, რომ საქართველოს დაცვა საქართველოს ყოველი მოქალაქის ვალია.",საქართველოს კონსტიტუცია,მუხლი 70,,2018-03-23,false,მხოლოდ სახელმწიფო ბიუჯეტის შედგენა,მხოლოდ არჩევნებში მონაწილეობა,საქართველოს დაცვა,მხოლოდ ადგილობრივი გადასახადის გადახდა,C
constitutional,constitution,"საქართველოს კონსტიტუციის მიხედვით, ვის წარდგინებით აცხადებს პრეზიდენტი საომარ მდგომარეობას საქართველოზე შეიარაღებული თავდასხმის ან მისი უშუალო საფრთხის შემთხვევაში?",hard,"სწორი პასუხია B, რადგან საქართველოს კონსტიტუციის მუხლი 71 ადგენს, რომ ასეთ შემთხვევაში პრეზიდენტი საომარ მდგომარეობას აცხადებს პრემიერ-მინისტრის წარდგინებით.",საქართველოს კონსტიტუცია,მუხლი 71,,2018-03-23,false,პარლამენტის თავმჯდომარის წარდგინებით,პრემიერ-მინისტრის წარდგინებით,გენერალური აუდიტორის წარდგინებით,სახალხო დამცველის წარდგინებით,B
constitutional,constitution,"საქართველოს კონსტიტუციის მიხედვით, რა წესი მოქმედებს საყოველთაო არჩევნებზე საგანგებო ან საომარი მდგომარეობის დროს?",medium,"სწორი პასუხია D, რადგან საქართველოს კონსტიტუციის მუხლი 71 ადგენს, რომ საგანგებო ან საომარი მდგომარეობის დროს საყოველთაო არჩევნები არ ტარდება.",საქართველოს კონსტიტუცია,მუხლი 71,,2018-03-23,false,არჩევნები ყოველთვის იმავე დღეს ტარდება,არჩევნები ტარდება მხოლოდ ონლაინ რეჟიმში,არჩევნებს ნიშნავს ეროვნული ბანკი,საყოველთაო არჩევნები არ ტარდება,D
