category_slug,subcategory_slug,text,difficulty,explanation,law_name,law_article,source_url,law_version_date,is_prime,option_a,option_b,option_c,option_d,correct_option
administrative,normative-acts,"საქართველოს ორგანული კანონის „ნორმატიული აქტების შესახებ“ მიხედვით, რომელი რეკვიზიტი უნდა ჰქონდეს ნორმატიულ აქტს?",easy,"სწორი პასუხია A, რადგან მუხლი 18 ნორმატიული აქტის რეკვიზიტებს შორის ასახელებს აქტის სახეს, სათაურს, მიღების თარიღსა და ადგილს, ძალაში შესვლის თარიღს, ხელმოწერასა და სარეგისტრაციო ნომერს.",საქართველოს ორგანული კანონი „ნორმატიული აქტების შესახებ“,მუხლი 18,,2026-06-12,false,"აქტის სახე, სათაური, თარიღი, ხელმოწერა და სარეგისტრაციო ნომერი",მხოლოდ აქტის ფერი და შრიფტის ზომა,მხოლოდ ზეპირი დასახელება,მხოლოდ განმარტებითი ბარათის ავტორის სახელი,A
administrative,normative-acts,"საქართველოს ორგანული კანონის „ნორმატიული აქტების შესახებ“ მიხედვით, ვის გადაეცემა ნორმატიული აქტის პროექტი სამართლებრივი დასკვნისთვის, თუ კანონი გამონაკლისს არ ადგენს?",medium,"სწორი პასუხია B, რადგან მუხლი 19 ადგენს, რომ ნორმატიული აქტის პროექტი სამართლებრივი დასკვნისთვის გადაეცემა საქართველოს იუსტიციის სამინისტროს, გარდა კანონით მითითებული გამონაკლისებისა.",საქართველოს ორგანული კანონი „ნორმატიული აქტების შესახებ“,მუხლი 19,,2026-06-12,false,საქართველოს საკანონმდებლო მაცნეს,საქართველოს იუსტიციის სამინისტროს,მხოლოდ კერძო იურიდიულ კომპანიას,მხოლოდ მუნიციპალიტეტის მერს,B
administrative,normative-acts,"საქართველოს ორგანული კანონის „ნორმატიული აქტების შესახებ“ მიხედვით, რა ვადაში იძლევა იუსტიციის სამინისტრო დასკვნას კანონქვემდებარე ნორმატიული აქტის პროექტზე?",medium,"სწორი პასუხია C, რადგან მუხლი 19 ადგენს, რომ საქართველოს იუსტიციის სამინისტრო კანონქვემდებარე ნორმატიული აქტის პროექტზე დასკვნას იძლევა პროექტის მისთვის გადაცემიდან 10 დღის ვადაში.",საქართველოს ორგანული კანონი „ნორმატიული აქტების შესახებ“,მუხლი 19,,2026-06-12,false,3 დღის ვადაში,5 თვის ვადაში,10 დღის ვადაში,1 წლის ვადაში,C
administrative,normative-acts,"საქართველოს ორგანული კანონის „ნორმატიული აქტების შესახებ“ მიხედვით, რა ხდება იუსტიციის სამინისტროს დასაბუთებული უარყოფითი დასკვნის შემთხვევაში?",hard,"სწორი პასუხია D, რადგან მუხლი 19 ადგენს, რომ უარყოფითი დასკვნის შემთხვევაში პროექტის შესაბამისობა კანონმდებლობასთან უნდა იყოს უზრუნველყოფილი, რის შემდეგაც იგი საჭიროებს იუსტიციის სამინისტროს ხელახალ დასკვნას.",საქართველოს ორგანული კანონი „ნორმატიული აქტების შესახებ“,მუხლი 19,,2026-06-12,false,პროექტი ავტომატურად ოფიციალურად ქვეყნდება,უარყოფითი დასკვნა ითვლება ნორმატიულ აქტად,პროექტი აღარასოდეს შეიძლება განიხილონ,პროექტი უნდა შესაბამისობაში მოვიდეს და ხელახალ დასკვნას საჭიროებს,D
administrative,normative-acts,"საქართველოს ორგანული კანონის „ნორმატიული აქტების შესახებ“ მიხედვით, რა ითვლება საქართველოს საკანონმდებლო აქტის მიღების თარიღად?",medium,"სწორი პასუხია A, რადგან მუხლი 20 ადგენს, რომ საქართველოს საკანონმდებლო აქტის მიღების თარიღად ჩაითვლება პარლამენტის მიერ მისი საბოლოო რედაქციით მიღების დღე.",საქართველოს ორგანული კანონი „ნორმატიული აქტების შესახებ“,მუხლი 20,,2026-06-12,false,პარლამენტის მიერ საბოლოო რედაქციით მიღების დღე,იუსტიციის სამინისტროს დასკვნის გაცემის დღე,საქართველოს საკანონმდებლო მაცნეში გადაცემის დღე,პროექტის პირველი საჯარო განხილვის დღე,A
administrative,normative-acts,"საქართველოს ორგანული კანონის „ნორმატიული აქტების შესახებ“ მიხედვით, რა ფორმით შეიტანება ცვლილება ნორმატიულ აქტში?",medium,"სწორი პასუხია B, რადგან მუხლი 20 ადგენს, რომ ნორმატიულ აქტში ცვლილების შეტანა ხდება მხოლოდ იმავე სახის ნორმატიული აქტით.",საქართველოს ორგანული კანონი „ნორმატიული აქტების შესახებ“,მუხლი 20,,2026-06-12,false,ნებისმიერი ზეპირი მითითებით,მხოლოდ იმავე სახის ნორმატიული აქტით,მხოლოდ ინდივიდუალური ადმინისტრაციული აქტით,მხოლოდ კერძო შეთანხმებით,B
administrative,normative-acts,"საქართველოს ორგანული კანონის „ნორმატიული აქტების შესახებ“ მიხედვით, როგორ ამტკიცებს საქართველოს პარლამენტი აჭარის ავტონომიური რესპუბლიკის კონსტიტუციას?",hard,"სწორი პასუხია C, რადგან მუხლი 21 ადგენს, რომ აჭარის ავტონომიური რესპუბლიკის კონსტიტუციას საქართველოს პარლამენტი ამტკიცებს ორგანული კანონით, ერთი მოსმენით განხილვისა და მიღების გზით.",საქართველოს ორგანული კანონი „ნორმატიული აქტების შესახებ“,მუხლი 21,,2026-06-12,false,"მინისტრის ბრძანებით, ორი მოსმენით","მუნიციპალიტეტის დადგენილებით, ერთი მოსმენით","ორგანული კანონით, ერთი მოსმენით განხილვისა და მიღების გზით","საერთაშორისო ხელშეკრულებით, რეფერენდუმის გარეშე",C
administrative,normative-acts,"საქართველოს ორგანული კანონის „ნორმატიული აქტების შესახებ“ მიხედვით, როდის შედის ძალაში ნორმატიული აქტი, რომლის ძალაში შესვლა გამოქვეყნებას უკავშირდება?",easy,"სწორი პასუხია D, რადგან მუხლი 22 ადგენს, რომ ასეთი ნორმატიული აქტი ძალაში შედის მხოლოდ ამ კანონით დადგენილი წესით ოფიციალურად გამოქვეყნების შემდეგ.",საქართველოს ორგანული კანონი „ნორმატიული აქტების შესახებ“,მუხლი 22,,2026-06-12,false,პროექტის მომზადებისთანავე,ზეპირი შეთანხმებისთანავე,ხელმოწერამდე ერთი დღით ადრე,ოფიციალურად გამოქვეყნების შემდეგ,D
administrative,normative-acts,"საქართველოს ორგანული კანონის „ნორმატიული აქტების შესახებ“ მიხედვით, რას ნიშნავს ჩანაწერი, რომ ნორმატიული აქტი ძალაში შედის გამოქვეყნებისთანავე?",medium,"სწორი პასუხია A, რადგან მუხლი 22 განმარტავს, რომ გამოქვეყნებისთანავე ძალაში შესვლა ნიშნავს გამოქვეყნების დღეს, 24 საათზე ძალაში შესვლას.",საქართველოს ორგანული კანონი „ნორმატიული აქტების შესახებ“,მუხლი 22,,2026-06-12,false,"გამოქვეყნების დღეს, 24 საათზე ძალაში შესვლას",გამოქვეყნებიდან ზუსტად ერთი წლის შემდეგ ძალაში შესვლას,პროექტის რეგისტრაციისთანავე ძალაში შესვლას,მხოლოდ სასამართლოს დადასტურების შემდეგ ძალაში შესვლას,A
administrative,normative-acts,"საქართველოს ორგანული კანონის „ნორმატიული აქტების შესახებ“ მიხედვით, როდის შედის ძალაში საქართველოს საკანონმდებლო აქტი, თუ თავად აქტით სხვა ვადა არ არის დადგენილი?",medium,"სწორი პასუხია B, რადგან მუხლი 23 ადგენს, რომ საქართველოს საკანონმდებლო აქტი ძალაში შედის ოფიციალურად გამოქვეყნებიდან მე-15 დღეს, თუ თვით აქტით სხვა ვადა არ არის დადგენილი.",საქართველოს ორგანული კანონი „ნორმატიული აქტების შესახებ“,მუხლი 23,,2026-06-12,false,ოფიციალურად გამოქვეყნების წინა დღეს,ოფიციალურად გამოქვეყნებიდან მე-15 დღეს,პროექტის ინიციირების დღეს,იუსტიციის სამინისტროს დასკვნის დღეს,B
administrative,normative-acts,"საქართველოს ორგანული კანონის „ნორმატიული აქტების შესახებ“ მიხედვით, როდის შედის ძალაში საქართველოს პრეზიდენტის დეკრეტი?",easy,"სწორი პასუხია C, რადგან მუხლი 23 ადგენს, რომ საქართველოს პრეზიდენტის დეკრეტი ძალაში შედის გამოცემის მომენტიდან.",საქართველოს ორგანული კანონი „ნორმატიული აქტების შესახებ“,მუხლი 23,,2026-06-12,false,ოფიციალურად გამოქვეყნებიდან მე-15 დღეს,მხოლოდ საკანონმდებლო მაცნეში რეგისტრაციის შემდეგ,გამოცემის მომენტიდან,მხოლოდ მომდევნო წლის 1 იანვრიდან,C
administrative,normative-acts,"საქართველოს ორგანული კანონის „ნორმატიული აქტების შესახებ“ მიხედვით, როდის აქვს ნორმატიულ აქტს უკუძალა?",easy,"სწორი პასუხია D, რადგან მუხლი 24 ადგენს, რომ ნორმატიულ აქტს უკუძალა აქვს მხოლოდ იმ შემთხვევაში, თუ ეს პირდაპირ არის დადგენილი ამ ნორმატიული აქტით.",საქართველოს ორგანული კანონი „ნორმატიული აქტების შესახებ“,მუხლი 24,,2026-06-12,false,"ყოველთვის, თუ აქტის გამომცემს სურს","ყოველთვის, როცა აქტი კანონქვემდებარეა","არასოდეს, არც პირდაპირი მითითებით","მხოლოდ მაშინ, თუ ეს პირდაპირ არის დადგენილი აქტით",D
administrative,normative-acts,"საქართველოს ორგანული კანონის „ნორმატიული აქტების შესახებ“ მიხედვით, აქვს თუ არა უკუძალა ნორმატიულ აქტს, რომელიც ადგენს ან ამძიმებს პასუხისმგებლობას?",easy,"სწორი პასუხია A, რადგან მუხლი 24 ადგენს, რომ ნორმატიულ აქტს, რომელიც ადგენს ან ამძიმებს პასუხისმგებლობას, უკუძალა არა აქვს.",საქართველოს ორგანული კანონი „ნორმატიული აქტების შესახებ“,მუხლი 24,,2026-06-12,false,უკუძალა არა აქვს,უკუძალა ყოველთვის აქვს,უკუძალა აქვს მხოლოდ მუნიციპალიტეტში,უკუძალა აქვს მხოლოდ კერძო ურთიერთობაში,A
administrative,normative-acts,"საქართველოს ორგანული კანონის „ნორმატიული აქტების შესახებ“ მიხედვით, რა შემთხვევაში კარგავს ძალას ნორმატიული აქტი ან მისი ნაწილი?",medium,"სწორი პასუხია B, რადგან მუხლი 25 ადგენს, რომ ნორმატიული აქტი ძალას კარგავს, თუ გავიდა მისი ვადა, მიღებულია მისი ძალადაკარგულად გამოცხადების აქტი ან უფლებამოსილი ორგანოს გადაწყვეტილება იწვევს ძალის დაკარგვას.",საქართველოს ორგანული კანონი „ნორმატიული აქტების შესახებ“,მუხლი 25,,2026-06-12,false,მხოლოდ როცა მოქალაქე წერილობით მოითხოვს,ვადის გასვლისას ან მისი ძალადაკარგულად გამოცხადებისას,მხოლოდ მისი ტექსტის თარგმნისას,მხოლოდ მედიაში კრიტიკის გამოქვეყნებისას,B
administrative,normative-acts,"საქართველოს ორგანული კანონის „ნორმატიული აქტების შესახებ“ მიხედვით, შეიძლება თუ არა ქვემდგომი აქტით უპირატესი იურიდიული ძალის მქონე აქტის ძალადაკარგულად გამოცხადება?",medium,"სწორი პასუხია C, რადგან მუხლი 25 ადგენს, რომ არ შეიძლება რომელიმე ნორმატიული აქტით უპირატესი იურიდიული ძალის მქონე ნორმატიული აქტის ძალადაკარგულად გამოცხადება.",საქართველოს ორგანული კანონი „ნორმატიული აქტების შესახებ“,მუხლი 25,,2026-06-12,false,შეიძლება ყოველთვის,შეიძლება მხოლოდ ადგილობრივი მნიშვნელობის საკითხებზე,არ შეიძლება,შეიძლება მხოლოდ განმარტებითი ბარათით,C
administrative,normative-acts,"საქართველოს ორგანული კანონის „ნორმატიული აქტების შესახებ“ მიხედვით, რა ითვლება ნორმატიული აქტის ოფიციალურ გამოქვეყნებად?",easy,"სწორი პასუხია D, რადგან მუხლი 26 ადგენს, რომ ნორმატიული აქტის ოფიციალურ გამოქვეყნებად ითვლება მისი სრული ტექსტის „საქართველოს საკანონმდებლო მაცნეს“ ვებგვერდზე პირველად გამოქვეყნება.",საქართველოს ორგანული კანონი „ნორმატიული აქტების შესახებ“,მუხლი 26,,2026-06-12,false,აქტის ტექსტის სოციალურ ქსელში განთავსება,აქტის ზეპირი გამოცხადება შეხვედრაზე,პროექტის არასახელმწიფო ენაზე გავრცელება,სრული ტექსტის „საქართველოს საკანონმდებლო მაცნეს“ ვებგვერდზე პირველად გამოქვეყნება,D
administrative,normative-acts,"საქართველოს ორგანული კანონის „ნორმატიული აქტების შესახებ“ მიხედვით, შეიძლება თუ არა გამოუქვეყნებელი დარჩეს ნორმატიული აქტი, რომელიც ზღუდავს უფლებებს ან ადგენს იურიდიულ პასუხისმგებლობას?",medium,"სწორი პასუხია A, რადგან მუხლი 26 ადგენს, რომ დაუშვებელია იმ ნორმატიული აქტის ან მისი ნაწილის გამოუქვეყნებლობა, რომელიც ზღუდავს უფლებებსა და თავისუფლებებს ან ადგენს იურიდიულ პასუხისმგებლობას.",საქართველოს ორგანული კანონი „ნორმატიული აქტების შესახებ“,მუხლი 26,,2026-06-12,false,არ შეიძლება მისი გამოუქვეყნებლობა,შეიძლება ყოველთვის,შეიძლება მხოლოდ შიდა წერილით,შეიძლება მხოლოდ არასახელმწიფო ენაზე,A
