category_slug,subcategory_slug,text,difficulty,explanation,law_name,law_article,source_url,law_version_date,is_prime,option_a,option_b,option_c,option_d,correct_option
administrative,normative-acts,"საქართველოს ორგანული კანონის „ნორმატიული აქტების შესახებ“ მიხედვით, რა ვადაში უნდა გადაეცეს ნორმატიული აქტი „საქართველოს საკანონმდებლო მაცნეს“ იუსტიციის სამინისტროს სამართლებრივი დასკვნის შემდეგ, თუ გამონაკლისი არ მოქმედებს?",medium,"სწორი პასუხია B, რადგან მუხლი 27 ადგენს, რომ საქართველოს ნორმატიული აქტი სამართლებრივი დასკვნის გაცემიდან 10 დღის ვადაში უნდა გადაეცეს „საქართველოს საკანონმდებლო მაცნეს“ გამოსაქვეყნებლად.",საქართველოს ორგანული კანონი „ნორმატიული აქტების შესახებ“,მუხლი 27,,2026-06-12,false,2 თვის ვადაში,10 დღის ვადაში,1 წლის ვადაში,30 სამუშაო დღის ვადაში,B
administrative,normative-acts,"საქართველოს ორგანული კანონის „ნორმატიული აქტების შესახებ“ მიხედვით, რა ვადაში უნდა გაეგზავნოს მუნიციპალიტეტის წარმომადგენლობითი ორგანოს ნორმატიული აქტი „საქართველოს საკანონმდებლო მაცნეს“?",medium,"სწორი პასუხია C, რადგან მუხლი 27 ადგენს, რომ მუნიციპალიტეტის წარმომადგენლობითი ორგანოს ნორმატიული აქტი უნდა გაეგზავნოს „საქართველოს საკანონმდებლო მაცნეს“ მისი მიღებიდან არაუგვიანეს მე-5 დღისა.",საქართველოს ორგანული კანონი „ნორმატიული აქტების შესახებ“,მუხლი 27,,2026-06-12,false,მისი მიღებიდან მე-20 დღეს,მისი მიღებიდან 1 წლის შემდეგ,მისი მიღებიდან არაუგვიანეს მე-5 დღისა,მხოლოდ მომდევნო საბიუჯეტო წელს,C
administrative,normative-acts,"საქართველოს ორგანული კანონის „ნორმატიული აქტების შესახებ“ მიხედვით, როდის უნდა ითქვას უარი ნორმატიული აქტის გამოქვეყნებაზე?",hard,"სწორი პასუხია D, რადგან მუხლი 28 ადგენს გამოქვეყნებაზე უარის საფუძვლებს, მათ შორის დადებითი დასკვნის არქონას ან დასკვნაგაცემული პროექტისგან შინაარსობრივ განსხვავებას, აგრეთვე მითითებული მოთხოვნების დარღვევას.",საქართველოს ორგანული კანონი „ნორმატიული აქტების შესახებ“,მუხლი 28,,2026-06-12,false,როცა აქტს ოფიციალური ტექსტი აქვს,როცა აქტი ქართულ ენაზეა მომზადებული,როცა აქტი ყველა რეკვიზიტს შეიცავს,როცა არ ახლავს საჭირო დადებითი დასკვნა ან დარღვეულია კანონით მოთხოვნილი პირობები,D
administrative,normative-acts,"საქართველოს ორგანული კანონის „ნორმატიული აქტების შესახებ“ მიხედვით, არის თუ არა ნორმატიული აქტის გამოქვეყნებაზე უარი ადმინისტრაციულ-სამართლებრივი აქტი?",medium,"სწორი პასუხია A, რადგან მუხლი 28 ადგენს, რომ გამოქვეყნებაზე უარი არ არის ადმინისტრაციულ-სამართლებრივი აქტი და მის მიმართ არ გამოიყენება ზოგადი ადმინისტრაციული კოდექსით გათვალისწინებული ადმინისტრაციული წარმოება.",საქართველოს ორგანული კანონი „ნორმატიული აქტების შესახებ“,მუხლი 28,,2026-06-12,false,არ არის ადმინისტრაციულ-სამართლებრივი აქტი,ყოველთვის არის ინდივიდუალური ადმინისტრაციული აქტი,ყოველთვის არის ნორმატიული აქტი,არის მხოლოდ მუნიციპალიტეტის დადგენილება,A
administrative,normative-acts,"საქართველოს ორგანული კანონის „ნორმატიული აქტების შესახებ“ მიხედვით, რა ორგანოა „საქართველოს საკანონმდებლო მაცნე“?",easy,"სწორი პასუხია B, რადგან მუხლი 29 ადგენს, რომ „საქართველოს საკანონმდებლო მაცნე“ არის საქართველოს იუსტიციის სამინისტროს მმართველობის სფეროში მოქმედი საჯარო სამართლის იურიდიული პირი.",საქართველოს ორგანული კანონი „ნორმატიული აქტების შესახებ“,მუხლი 29,,2026-06-12,false,კერძო სააქციო საზოგადოება,იუსტიციის სამინისტროს მმართველობის სფეროში მოქმედი საჯარო სამართლის იურიდიული პირი,საერთაშორისო სასამართლო,მუნიციპალიტეტის კომერციული საწარმო,B
administrative,normative-acts,"საქართველოს ორგანული კანონის „ნორმატიული აქტების შესახებ“ მიხედვით, რა ფორმით წარმოებს სახელმწიფო რეესტრი, გარდა „საიდუმლო“ ნაწილისა?",medium,"სწორი პასუხია C, რადგან მუხლი 29 ადგენს, რომ სახელმწიფო რეესტრი, გარდა „საიდუმლო“ ნაწილისა, წარმოებს ელექტრონული ფორმით „საქართველოს საკანონმდებლო მაცნეს“ ვებგვერდზე.",საქართველოს ორგანული კანონი „ნორმატიული აქტების შესახებ“,მუხლი 29,,2026-06-12,false,მხოლოდ ქაღალდის არქივში,მხოლოდ ზეპირი ჩანაწერით,ელექტრონული ფორმით „საქართველოს საკანონმდებლო მაცნეს“ ვებგვერდზე,მხოლოდ კერძო მონაცემთა ბაზაში,C
administrative,normative-acts,"საქართველოს ორგანული კანონის „ნორმატიული აქტების შესახებ“ მიხედვით, რა იურიდიული ძალა აქვს 1997 წლის 1 თებერვლამდე მიღებულ კანონქვემდებარე ნორმატიულ აქტს, თუ იგი არ არის რეგისტრირებული სახელმწიფო რეესტრში?",hard,"სწორი პასუხია D, რადგან მუხლი 30 ადგენს, რომ 1997 წლის 1 თებერვლამდე მიღებულ კანონქვემდებარე ნორმატიულ აქტს, რომელიც არ არის რეგისტრირებული სახელმწიფო რეესტრში, იურიდიული ძალა არა აქვს.",საქართველოს ორგანული კანონი „ნორმატიული აქტების შესახებ“,მუხლი 30,,2026-06-12,false,იგი ყოველთვის ძალაშია უვადოდ,იგი ავტომატურად კონსტიტუციურ კანონად ითვლება,იგი მოქმედებს მხოლოდ საერთაშორისო ურთიერთობებში,იურიდიული ძალა არა აქვს,D
administrative,normative-acts,"საქართველოს ორგანული კანონის „ნორმატიული აქტების შესახებ“ მიხედვით, რა მონაცემები უნდა მიეთითოს 2011 წლის 1 იანვრამდე გამოქვეყნებულ ნორმატიულ აქტში ცვლილების შეტანის პროექტში?",hard,"სწორი პასუხია A, რადგან მუხლი 32¹ ადგენს, რომ ასეთ პროექტში უნდა მიეთითოს ნორმატიული აქტის სათაური, ოფიციალური გამოქვეყნების ორგანოს სახელწოდება, გამოქვეყნების თარიღი, აგრეთვე მუხლი და გვერდი მათი არსებობის შემთხვევაში.",საქართველოს ორგანული კანონი „ნორმატიული აქტების შესახებ“,მუხლი 32¹,,2026-06-12,false,"აქტის სათაური, ოფიციალური გამოქვეყნების ორგანო, თარიღი, მუხლი და გვერდი",მხოლოდ ავტორის პირადი ნომერი,მხოლოდ განმარტებითი ბარათის მოცულობა,მხოლოდ აქტის ტექსტის ფერი და შრიფტი,A
administrative,normative-acts,"საქართველოს ორგანული კანონის „ნორმატიული აქტების შესახებ“ მიხედვით, რომელი კანონი გამოცხადდა ძალადაკარგულად ამ კანონის ამოქმედებასთან დაკავშირებით?",medium,"სწორი პასუხია B, რადგან მუხლი 33 ადგენს, რომ ძალადაკარგულად იქნეს ცნობილი „ნორმატიული აქტების შესახებ“ საქართველოს კანონი.",საქართველოს ორგანული კანონი „ნორმატიული აქტების შესახებ“,მუხლი 33,,2026-06-12,false,„საქართველოს მოქალაქეობის შესახებ“ საქართველოს კანონი,„ნორმატიული აქტების შესახებ“ საქართველოს კანონი,„საჯარო სამსახურის შესახებ“ საქართველოს კანონი,„ადგილობრივი თვითმმართველობის შესახებ“ საქართველოს კანონი,B
